{
  "id": "S9",
  "name": "gauntlet",
  "description": "all of S1-S8 at once for the whole attack window: CPU flood, DB hog, memory bomb, retry storm, slow ramp, 1MB payload flood and a second memory abuser, while bursty-news legitimately spikes 10x; victims protected, no false positive",
  "default_seed": 42,
  "phases": [
    {
      "name": "warmup",
      "duration_s": 10
    },
    {
      "name": "attack",
      "duration_s": 150
    },
    {
      "name": "cooldown",
      "duration_s": 20
    }
  ],
  "tenants": [
    {
      "tenant": "acme-shop",
      "role": "victim",
      "arrivals": [
        {
          "phase": "warmup",
          "process": "poisson",
          "rps": 30,
          "task_mix": [
            {
              "task": "echo",
              "weight": 0.85
            },
            {
              "task": "db-query",
              "weight": 0.15,
              "params": {
                "n": 1
              }
            }
          ]
        },
        {
          "phase": "attack",
          "process": "poisson",
          "rps": 30,
          "task_mix": [
            {
              "task": "echo",
              "weight": 0.85
            },
            {
              "task": "db-query",
              "weight": 0.15,
              "params": {
                "n": 1
              }
            }
          ]
        },
        {
          "phase": "cooldown",
          "process": "poisson",
          "rps": 30,
          "task_mix": [
            {
              "task": "echo",
              "weight": 0.85
            },
            {
              "task": "db-query",
              "weight": 0.15,
              "params": {
                "n": 1
              }
            }
          ]
        }
      ]
    },
    {
      "tenant": "data-co",
      "role": "victim",
      "arrivals": [
        {
          "phase": "warmup",
          "process": "poisson",
          "rps": 8,
          "task_mix": [
            {
              "task": "db-query",
              "weight": 1,
              "params": {
                "n": 5
              }
            }
          ]
        },
        {
          "phase": "attack",
          "process": "poisson",
          "rps": 8,
          "task_mix": [
            {
              "task": "db-query",
              "weight": 1,
              "params": {
                "n": 5
              }
            }
          ]
        },
        {
          "phase": "cooldown",
          "process": "poisson",
          "rps": 8,
          "task_mix": [
            {
              "task": "db-query",
              "weight": 1,
              "params": {
                "n": 5
              }
            }
          ]
        }
      ]
    },
    {
      "tenant": "bursty-news",
      "role": "false_positive_probe",
      "arrivals": [
        {
          "phase": "warmup",
          "process": "poisson",
          "rps": 5,
          "task_mix": [
            {
              "task": "echo",
              "weight": 1
            }
          ]
        },
        {
          "phase": "attack",
          "process": "burst",
          "rps": 5,
          "task_mix": [
            {
              "task": "echo",
              "weight": 1
            }
          ],
          "burst_multiplier": 10,
          "burst_duration_s": 20
        },
        {
          "phase": "cooldown",
          "process": "poisson",
          "rps": 5,
          "task_mix": [
            {
              "task": "echo",
              "weight": 1
            }
          ]
        }
      ]
    },
    {
      "tenant": "leaky-app",
      "role": "culprit",
      "arrivals": [
        {
          "phase": "warmup",
          "process": "poisson",
          "rps": 2,
          "task_mix": [
            {
              "task": "mem-alloc",
              "weight": 1,
              "params": {
                "mb": 16,
                "hold_ms": 500
              }
            }
          ]
        },
        {
          "phase": "attack",
          "process": "poisson",
          "rps": 10,
          "task_mix": [
            {
              "task": "mem-alloc",
              "weight": 1,
              "params": {
                "mb": 512,
                "hold_ms": 2000
              }
            }
          ]
        },
        {
          "phase": "cooldown",
          "process": "poisson",
          "rps": 2,
          "task_mix": [
            {
              "task": "mem-alloc",
              "weight": 1,
              "params": {
                "mb": 16,
                "hold_ms": 500
              }
            }
          ]
        }
      ]
    },
    {
      "tenant": "rogue-ml",
      "role": "culprit",
      "arrivals": [
        {
          "phase": "warmup",
          "process": "poisson",
          "rps": 1,
          "task_mix": [
            {
              "task": "echo",
              "weight": 1
            }
          ]
        },
        {
          "phase": "attack",
          "process": "poisson",
          "rps": 20,
          "task_mix": [
            {
              "task": "cpu-burn",
              "weight": 1,
              "params": {
                "ms": 2000
              }
            }
          ]
        },
        {
          "phase": "attack",
          "process": "poisson",
          "rps": 8,
          "task_mix": [
            {
              "task": "db-query",
              "weight": 1,
              "params": {
                "n": 500
              }
            }
          ]
        },
        {
          "phase": "attack",
          "process": "poisson",
          "rps": 0.5,
          "task_mix": [
            {
              "task": "mem-alloc",
              "weight": 1,
              "params": {
                "mb": 4096,
                "hold_ms": 3000
              }
            }
          ]
        },
        {
          "phase": "attack",
          "process": "poisson",
          "rps": 25,
          "task_mix": [
            {
              "task": "cpu-burn",
              "weight": 1,
              "params": {
                "ms": 500
              }
            }
          ],
          "retry_without_backoff": true
        },
        {
          "phase": "attack",
          "process": "ramp",
          "rps": 2,
          "task_mix": [
            {
              "task": "cpu-burn",
              "weight": 1,
              "params": {
                "ms": 500
              }
            }
          ],
          "rps_end": 30
        },
        {
          "phase": "attack",
          "process": "poisson",
          "rps": 10,
          "task_mix": [
            {
              "task": "payload",
              "weight": 1,
              "payload_bytes": 1000000
            }
          ]
        },
        {
          "phase": "cooldown",
          "process": "poisson",
          "rps": 1,
          "task_mix": [
            {
              "task": "echo",
              "weight": 1
            }
          ]
        }
      ]
    }
  ],
  "assertions": [
    {
      "metric": "victim_p99_inflation",
      "op": "<=",
      "value": 2
    },
    {
      "metric": "victim_errors",
      "op": "==",
      "value": 0
    },
    {
      "metric": "false_positive_count",
      "op": "==",
      "value": 0
    }
  ]
}
